{
  "$schema": "https://github.com/Ricardo121380/only-my-pi/schemas/workflow-cancel-request-v1.schema.json",
  "createdAt": "2026-08-19T00:00:00.000Z",
  "formatVersion": 1,
  "reason": "operator requested stop",
  "requestId": "cancel-request-example",
  "runId": "example-run",
  "status": "PENDING",
  "updatedAt": "2026-08-19T00:00:00.000Z",
  "digest": "sha256:5d94a78b95f5d4e12b7f1b09a1ed7dd4e5407f3cd39332a08c3c089110bf76c6"
}
